"id","post_id","autor_id","contenido","imagenes","created_at","updated_at"
1,1,1,Verificaron el estado de los cables coaxiales? A veces la condensación entra en los conectores.,,2026-01-14 16:01:19.958,2026-01-14 16:01:19.958
2,1,1,En Córdoba tuvimos algo parecido y era un problema en la fuente de alimentación del monitor.,,2026-01-14 16:01:20.268,2026-01-14 16:01:20.268
3,2,4,Asegurate de que el switch de mantenimiento esté bien enclavado antes de apagar el inversor.,,2026-01-14 16:01:20.893,2026-01-14 16:01:20.893
4,2,2,"Gracias por el dato, todo salió perfecto.",,2026-01-14 16:01:21.203,2026-01-14 16:01:21.203
5,3,4,"Fijate si hay alguna radio FM pirata cerca, suele ser la causa número 1.",,2026-01-14 16:01:21.763,2026-01-14 16:01:21.763
6,3,1,También chequea los aisladores de la línea de alta tensión cercana.,,2026-01-14 16:01:22.085,2026-01-14 16:01:22.085
7,5,2,"Recibido, gracias.",,2026-01-14 16:01:23.126,2026-01-14 16:01:23.126
8,5,5,¿Dónde queda el registro de la tarea?,,2026-01-14 16:01:23.436,2026-01-14 16:01:23.436
